{
  "callId": "call_01HZXB2R8T",
  "startedAt": "2026-10-27T15:40:12+08:00",
  "endedAt": null,
  "claimedAgency": "LHDN",
  "events": [
    {
      "at": "2026-10-27T15:40:41+08:00",
      "stage": "authority",
      "risk": "medium",
      "source": "rules",
      "evidence": [
        "saya pegawai LHDN, cukai puan tertunggak"
      ]
    }
  ]
}
